{
  "name": "My Example List",
  "keywords": [
    "abc"
  ],
  "tags": {
    "1": {
      "name": "tag 1",
      "description": "blah blah"
    }
  },
  "timestamp": 1591897594,
  "tokens": [
    {
      "name": "blah blah ",
      "address": "0x0000000000000000000000000000000000000000",
      "chainId": 1,
      "decimals": 18,
      "logoUrl": "https://test",
      "symbol": "abc",
      "tags": [
        "coin"
      ]
    }
  ],
  "version": {
    "major": 0,
    "minor": -1,
    "patch": 0
  }
}